{
  "branch": "fix/workspace-lifecycle-closure",
  "branch_head_ci": {
    "check_name": "branch-head",
    "detail": "status=COMPLETED, conclusion=SUCCESS",
    "run_id": "29348194033",
    "run_url": "https://github.com/lennertvhoy/StateDD_Template/actions/runs/29348194033",
    "state": "SUCCESS",
    "subject_sha": "400624ae6616403fcc768ceb5ba7a15bf471bb85",
    "workflow_path": ".github/workflows/validate.yml"
  },
  "default_branch": "main",
  "default_branch_head": "d495589cfde23aae73aa83259f2381f78662cff1",
  "delivery_policy_mode": "agent_after_green",
  "evidence_folder": "~/.local/state/statedd/workspaces/statedd-workspace-lifecycle-20260714-45209e40e11ef1c5/active/fix-workspace-lifecycle-closure-c43584a99a/docs/evidence/2026-07-14-workspace-lifecycle-closure",
  "expected_pr_head": "400624ae6616403fcc768ceb5ba7a15bf471bb85",
  "failure": null,
  "generated_at": "2026-07-14T18:09:24+02:00",
  "isolation_disposition": "quarantined",
  "isolation_mode": "clone",
  "isolation_original_path": "~/.local/state/statedd/workspaces/statedd-workspace-lifecycle-20260714-45209e40e11ef1c5/active/fix-workspace-lifecycle-closure-c43584a99a",
  "isolation_original_path_absent": true,
  "isolation_quarantine_path": "~/.local/state/statedd/workspaces/statedd-workspace-lifecycle-20260714-45209e40e11ef1c5/quarantine/fix-workspace-lifecycle-closure-400624ae6616-20260714T160924741748Z-78852834",
  "isolation_released": true,
  "main_ci": {
    "check_name": "branch-head",
    "detail": "status=COMPLETED, conclusion=SUCCESS",
    "run_id": "29348333932",
    "run_url": "https://github.com/lennertvhoy/StateDD_Template/actions/runs/29348333932",
    "state": "SUCCESS",
    "subject_sha": "d495589cfde23aae73aa83259f2381f78662cff1",
    "workflow_path": ".github/workflows/validate.yml"
  },
  "merge_candidate_ci": {
    "check_name": "merge-candidate",
    "detail": "status=COMPLETED, conclusion=SUCCESS",
    "run_id": "29348194033",
    "run_url": "https://github.com/lennertvhoy/StateDD_Template/actions/runs/29348194033",
    "state": "SUCCESS",
    "subject_sha": "400624ae6616403fcc768ceb5ba7a15bf471bb85",
    "workflow_path": ".github/workflows/validate.yml"
  },
  "merge_commit": "d495589cfde23aae73aa83259f2381f78662cff1",
  "merge_method": "squash",
  "post_merge_output": "/tmp/statedd-workspace-lifecycle-final-handoff.post-merge.json",
  "post_merge_verified": true,
  "pr_number": 16,
  "pr_url": "https://github.com/lennertvhoy/StateDD_Template/pull/16",
  "proof_head": "5a974ec9996edcd2f19cfe4b1606c2b8cf2159f3",
  "recoverable_state_retained": true,
  "remote_branch_absent": true,
  "remote_closure_output": "/tmp/statedd-workspace-lifecycle-final-handoff.remote-closure.json",
  "repository": "~/.local/state/statedd/workspaces/statedd-workspace-lifecycle-20260714-45209e40e11ef1c5/active/fix-workspace-lifecycle-closure-c43584a99a",
  "schema": "statedd.finish_slice_handoff.v2",
  "status": "HANDOFF_COMPLETE",
  "transitions": [
    "LOCAL_VALIDATED",
    "PUSHED",
    "PR_OPEN",
    "PR_READY",
    "REMOTE_CLOSURE_VERIFIED",
    "MERGED",
    "MAIN_CI_VERIFIED",
    "HANDOFF_COMPLETE"
  ]
}
